{
  "$schema": "../../../schemas/tile.schema.json",
  "id": "tile:ruin-mosaic",
  "kind": "tile",
  "solid": false,
  "layers": [
    { "op": "fill", "color": "#6d604a" },
    { "op": "rect", "color": "#3b2416", "x": 0, "y": 0, "w": 16, "h": 1 },
    { "op": "rect", "color": "#3b2416", "x": 0, "y": 15, "w": 16, "h": 1 },
    { "op": "rect", "color": "#c9b36a", "x": 2, "y": 2, "w": 12, "h": 1 },
    { "op": "rect", "color": "#c9b36a", "x": 2, "y": 13, "w": 12, "h": 1 },
    { "op": "rect", "color": "#8a2f2f", "x": 3, "y": 4, "w": 3, "h": 3 },
    { "op": "rect", "color": "#425663", "x": 10, "y": 4, "w": 3, "h": 3 },
    { "op": "rect", "color": "#eed7a1", "x": 7, "y": 7, "w": 2, "h": 2 },
    { "op": "rect", "color": "#5d5140", "x": 4, "y": 11, "w": 8, "h": 1 }
  ],
  "koota": { "traits": ["Tile"] }
}
