{
  "$schema": "../../../schemas/tile.schema.json",
  "id": "tile:stone-floor",
  "kind": "tile",
  "solid": false,
  "layers": [
    { "op": "fill", "color": "#2b2b36" },
    { "op": "rect", "color": "#14141a", "x": 0, "y": 0, "w": 16, "h": 1 },
    { "op": "rect", "color": "#14141a", "x": 0, "y": 0, "w": 1, "h": 16 },
    { "op": "rect", "color": "#3c3c4a", "x": 4, "y": 4, "w": 2, "h": 2 }
  ],
  "koota": { "traits": ["Tile"] }
}
