{
  "$schema": "../../../schemas/tile.schema.json",
  "id": "tile:grass",
  "kind": "tile",
  "solid": false,
  "layers": [
    { "op": "fill", "color": "@e" },
    { "op": "rect", "color": "@E", "x": 1, "y": 5, "w": 2, "h": 1 },
    { "op": "rect", "color": "@T", "x": 12, "y": 10, "w": 2, "h": 1 },
    { "op": "rect", "color": "#142a07", "x": 2, "y": 2, "w": 1, "h": 1 },
    { "op": "rect", "color": "#142a07", "x": 10, "y": 6, "w": 1, "h": 1 },
    { "op": "rect", "color": "#142a07", "x": 5, "y": 11, "w": 1, "h": 1 },
    { "op": "rect", "color": "@D", "x": 14, "y": 3, "w": 1, "h": 1 }
  ],
  "koota": { "traits": ["Tile"] }
}
